{
  "id": "EV-PA01-F3D35F371C70",
  "kind": "worktree",
  "metadata": {},
  "node_id": "PA01",
  "recorded_at": "2026-08-24T14:05:21Z",
  "ref": "codex/productization-alpha-platform-hardening",
  "schema_version": "1.0.0",
  "status": "verified",
  "summary": "PA01 ownership moved to the platform-hardening branch while the feature freeze remains active"
}
