{
  "id": "EV-RM-00-2B844CD6A3C5",
  "kind": "test",
  "metadata": {},
  "node_id": "RM-00",
  "recorded_at": "2026-08-17T01:39:48Z",
  "ref": "local://pytest-fast-no-postgres-origin-dev-67ad24d",
  "schema_version": "1.0.0",
  "status": "verified",
  "summary": "Fast gate rebased onto origin/dev 67ad24d: 1916 passed, 17 skipped, 133 deselected in 244.92s"
}
