{
  "id": "EV-I01-40C28139410C",
  "kind": "ci",
  "metadata": {},
  "node_id": "I01",
  "recorded_at": "2026-08-16T13:54:37Z",
  "ref": "https://github.com/JToday666/agent-guard/actions/runs/31948367126/job/95167884022",
  "schema_version": "1.0.0",
  "status": "verified",
  "summary": "Python 3.12 and PostgreSQL 16 CI passed"
}
