{
  "id": "EV-R05-8ADDBD90353A",
  "kind": "commit",
  "metadata": {},
  "node_id": "R05",
  "recorded_at": "2026-08-17T02:09:02Z",
  "ref": "67ad24dfbb4f6c84b68f8c490f9a8daeda6a37a3",
  "schema_version": "1.0.0",
  "status": "verified",
  "summary": "RTE-05 strong approval binding implementation merged into origin/dev via PR #162; host capability closure remains blocked"
}
