{
  "schema_version": "1.0.0",
  "id": "EV-FE03-COMMIT",
  "node_id": "FE03",
  "kind": "commit",
  "ref": "e16b854",
  "status": "verified",
  "summary": "Reviewed Git mapping for FE03; e16b854 is reachable from origin/dev.",
  "recorded_at": null,
  "metadata": {
    "baseline_ref": "origin/dev",
    "mapping": "reviewed"
  }
}
