{
  "id": "EV-FE08-3A247A306DC9",
  "kind": "commit",
  "metadata": {},
  "node_id": "FE08",
  "recorded_at": "2026-08-17T05:36:46Z",
  "ref": "b2287382b7501759b9eb36e9afe65fef92c1bd1b",
  "schema_version": "1.0.0",
  "status": "verified",
  "summary": "PR #172 implementation is merged and reachable from origin/dev"
}
