{
  "id": "EV-CT04-613A8D69EA79",
  "kind": "ci",
  "metadata": {},
  "node_id": "CT04",
  "recorded_at": "2026-08-17T05:59:39Z",
  "ref": "github:pr174-node-fast+release-artifacts",
  "schema_version": "1.0.0",
  "status": "verified",
  "summary": "PR #174 Node fast gate and release artifact verification passed; product acceptance relies on the verified targeted Python/Core/LangGraph suites recorded separately, and the aggregate Python fast result is intentionally not a delivery blocker for this Operational MVP"
}
