{
  "id": "EV-FE08-4995CE0CA361",
  "kind": "test",
  "metadata": {},
  "node_id": "FE08",
  "recorded_at": "2026-08-17T05:09:17Z",
  "ref": "dashboard:node-test+vue-tsc+vite-build@2026-08-17",
  "schema_version": "1.0.0",
  "status": "pending",
  "summary": "FE08 strict enforcement projection: 33/33 Node test files passed; vue-tsc passed; Vite production build passed. Covers exact release, pre/post-consume failure, ID pairing, malformed/unknown/duplicate reason, start drift, DENY non-inference, confirmed gate violation, and forbidden-secret non-projection."
}
