{
  "schema_version": "1.0.0",
  "id": "EV-G-NATIVE-ID-COMMIT",
  "node_id": "G-NATIVE-ID",
  "kind": "commit",
  "ref": "d1baf99",
  "status": "verified",
  "summary": "Reviewed Git evidence for G-NATIVE-ID; d1baf99 is reachable from origin/dev.",
  "recorded_at": null,
  "metadata": {
    "baseline_ref": "origin/dev",
    "mapping": "reviewed"
  }
}
