{
  "id": "EV-CT04M-8BE3B11EF35A",
  "kind": "commit",
  "metadata": {},
  "node_id": "CT04M",
  "recorded_at": "2026-08-17T07:10:18Z",
  "ref": "eca94a8544534705eb3b03e6d23bc32cf5a1efad",
  "schema_version": "1.0.0",
  "status": "verified",
  "summary": "Correct full origin/dev merge identity for CT04M."
}
