{
  "id": "EV-FE06-7CA1C5E65930",
  "kind": "ci",
  "metadata": {},
  "node_id": "FE06",
  "recorded_at": "2026-08-17T10:09:08Z",
  "ref": "https://github.com/JToday666/agent-guard/actions/runs/31958860645/job/95193647311",
  "schema_version": "1.0.0",
  "status": "verified",
  "summary": "PR #159 Dashboard S2 live PostgreSQL E2E passed with the compatibility mapper on persisted live evidence"
}
